IUS Spring 2025 Course schedule Undergraduate,,,,,,
Code,Course Code and Name,Day1,Day2,Venue 1,Venue 2,Important Notes
AID101.1,AID101.1 Fundamentals of Data Science,Tue. 09:00-11:50,,B F2.17,,
AID304.1,AID304.1 Big Data Analytics,Thu. 14:00-16:50,,B F1.25 Computer Lab,,
ARCH100.1,ARCH100.1 Introduction to Architectural Design,Wed. 09:00-11:50,,A F3.8 - Big Architecture Studio,,
ARCH101.1,ARCH101.1 Basic Design Communication,Mon. 09:00-11:50,,A F3.10 - Architecture Classroom,,
ARCH102.1,ARCH102.1 History of Architecture I,Wed. 12:00-12:50,,A F2.14 - Amphitheater II,A F3.8 ARCH Studio 1,Seond and 3rd hors in studio
ARCH106.1,ARCH106.1 Introduction to Building Technology,Fri. 09:00-11:50,,A F3.7 ARCH Studio 2,,
ARCH107.1,ARCH107.1 Understanding Art and Architecture,Mon. 10:00-11:50,,B F1.23 - Amphitheater I,,
ARCH108.1,ARCH108.1 Introduction to Architectural Design II,Thu. 09:00-11:50,,A F3.8 - Big Architecture Studio,,
ARCH108.2,ARCH108.2 Introduction to Architectural Design II,Thu. 09:00-11:50,,A F3.7 - Small Architecture Studio,,
ARCH109.1,ARCH109.1 Basic Design Communication II,Mon. 13:00-14:50,,A F3.10 - Architecture Classroom,,
ARCH109.2,ARCH109.2 Basic Design Communication II,Mon. 13:00-14:50,,A F2.8 - Drawing Studio,,
ARCH110.1,ARCH110.1 Freehand Drawing,Thu. 13:00-14:50,,A B.16 - VACD Drawing Studio,,
ARCH201.1,ARCH201.1 Architectural Design Studio I,Tue. 09:00-14:50,,A F3.8 - Big Architecture Studio,,
ARCH201.2,ARCH201.2 Architectural Design Studio I,Tue. 09:00-14:50,,A B.8 - Fabrication Lab,,
ARCH202.1,ARCH202.1 Architectural Design Studio II,Tue. 09:00-14:50,,A F3.7 - Small Architecture Studio,,
ARCH202.2,ARCH202.2 Architectural Design Studio II,Tue. 09:00-14:50,,A F3.10 - Architecture Classroom,,
ARCH202.3,ARCH202.3 Architectural Design Studio II,Tue. 09:00-14:50,,A F2.8 - Drawing Studio,,
ARCH208.1,ARCH208.1 Architectural Communication,Thu. 09:00-11:50,,A F1.3 - Computer Lab,,
ARCH208.2,ARCH208.2 Architectural Communication,Thu. 12:00-14:50,,A F1.3 - Computer Lab,,
ARCH209.1,ARCH209.1 History of Architecture III,Mon. 13:00-14:50,,B F1.23 - Amphitheater I,,
ARCH210.1,ARCH210.1 Structural Design II,Mon. 09:00-10:50,,A F3.7 ARCH Studio 2,A F3.8 ARCH Studio 1,Two Studios Are Used
ARCH211.1,ARCH211.1 Building Services II,Thu. 09:00-10:50,,A F2.16 - Architecture Studio,,
ARCH216.1,ARCH216.1 Introduction to CAD,Fri. 10:00-11:50,,A F1.3 - Computer Lab,,
ARCH216-6.1,ARCH216-6.1 Introduction to CAD,Fri. 10:00-11:50,,A F1.3 - Computer Lab,,
ARCH303.1,ARCH303.1 Architectural Design Studio III,Wed. 09:00-14:50,,A F2.16 - Architecture Studio,,
ARCH303.2,ARCH303.2 Architectural Design Studio III,Wed. 09:00-14:50,,A F3.7 - Small Architecture Studio,,
ARCH304.1,ARCH304.1 Architectural Design Studio IV,Wed. 09:00-14:50,,A F3.10 - Architecture Classroom,,
ARCH304.2,ARCH304.2 Architectural Design Studio IV,Wed. 09:00-14:50,,A F2.8 - Drawing Studio,,
ARCH307.1,ARCH307.1 Sustainable Design,Fri. 09:00-10:50,,A F3.8 - Big Architecture Studio,,
ARCH308.1,ARCH308.1 Urban History,Thu. 13:00-14:50,,A F3.7 - Small Architecture Studio,,
ARCH311.1,ARCH311.1 Materials in Architecture,Mon. 13:00-14:50,,A F3.7 ARCH Studio 2,A F3.8 ARCH Studio 1,Two Studios Are Used
ARCH357.1,ARCH357.1 Bosnian Architecture,Thu. 13:00-14:50,,A F3.10 - Architecture Classroom,,
ARCH358.1,ARCH358.1 Building Construction II,Mon. 13:00-14:50,,A F3.7 ARCH Studio 2,A F3.8 ARCH Studio 1,Two Studios Are Used
ARCH360.1,ARCH360.1 Digital Architecture and Fabrication,Fri. 14:00-15:50,,A F1.3 - Computer Lab,,
ARCH403.1,ARCH403.1 Management in Architecture,Mon. 11:00-12:50,,A F2.16 - Architecture Studio,,
ARCH405.1,ARCH405.1 Architectural Design Studio V,Tue. 09:00-14:50,,A F2.16 - Architecture Studio,,
ARCH412.1,ARCH412.1 Advanced Building Construction,Mon. 13:00-14:50,,A F2.16 - Architecture Studio,,
ARCH414.1,ARCH414.1 Introduction to Islamic Architecture,Thu. 11:00-12:50,,A F2.8 - Drawing Studio,,
BIO305.1,BIO305.1 Biochemistry II,Thu. 09:00-11:50,,A F1.10,,
BIO306.1,BIO306.1 General Microbiology,Wed. 09:00-11:50,,B F2.6,,
BIO312.1,BIO312.1 Techniques in Molecular Biology,Mon. 09:00-10:50,,B F2.14,,
BIO404.1,BIO404.1 Agricultural Biotechnology,Tue. 09:00-11:50,,B F1.16,,
BIO407.1,BIO407.1 Protein Engineering,Wed. 15:00-17:50,,A F1.26,,
BIO424.1,BIO424.1 Introduction to Forensic Science,Thu. 12:00-14:50,,B F1.16,,Day and time change
BOS111.1,BOS111.1 Spoken Bosnian I,Mon. 10:00-11:50,,A F2.3,,
BOS111.2,BOS111.2 Spoken Bosnian I,Mon. 13:00-14:50,,B F2.16,,
BOS112.1,BOS112.1 Spoken Bosnian II,Tue. 14:00-15:50,,A F1.26,,
BOS112.2,BOS112.2 Spoken Bosnian II,Mon. 10:00-11:50,,A F1.23,,
BOS112.3,BOS112.3 Spoken Bosnian II,Mon. 13:00-14:50,,B F2.14,,
CS103.1,CS103.1 Introduction to Programming,Mon. 15:00-17:50,,B F1.23 - Amphitheater I,,
CS103.2,CS103.2 Introduction to Programming,Tue. 13:00-15:50,,B F1.23 - Amphitheater I,,
CS105.1,CS105.1 Advanced Programming,Wed. 11:00-13:50,,B F2.15 - Amphitheater II,,
CS105.2,CS105.2 Advanced Programming,Tue. 15:00-17:50,,A F1.24 - Amphitheater I,,
CS207.1,CS207.1 Analysis of Algorithms,Thu. 09:00-11:50,,B F2.17,,
CS207.2,CS207.2 Analysis of Algorithms,Mon. 12:00-14:50,,A F2.3,,
CS303.1,CS303.1 Digital Design,Tue. 09:00-11:50,,B F1.9,,
CS304.1,CS304.1 Computer Architecture,Mon. 09:00-11:50,,B F2.15 - Amphitheater II,,
CS306.1,CS306.1 Database Management,Tue. 12:00-14:50,,A F2.14 Amphitheater II,,
CS308.1,CS308.1 Software Engineering,Mon. 16:00-18:50,,A F2.14 - Amphitheater II,,
CS310.1,CS310.1 Human Computer Interaction,Wed. 12:00-14:50,,B F1.23 - Amphitheater I,,
CS314.1,CS314.1 Systems Programming,Wed. 12:00-14:50,,A F2.3,,
CS404.1,CS404.1 Artificial Intelligence,Fri. 09:00-11:50,,B F2.6,,
CS413.1,CS413.1 Developing the Interactive Web,Wed. 16:00-18:50,,B F1.25 Computer Lab,,
CS417.1,CS417.1 Introduction to Data Mining,Wed. 09:00-11:50,,B F1.16,,
CS427.1,CS427.1 Computer and Network Security,Mon. 12:00-14:50,,B F1.25 Computer Lab,,
CULT101.1,CULT101.1 Understanding Cultural Encounters,Tue. 09:00-10:50,,A F1.17,,
CULT101.2,CULT101.2 Understanding Cultural Encounters,Tue. 11:00-12:50,,A F1.17,,
ECON108.1,ECON108.1 Matlab,Thu. 13:00-14:50,,B F1.2 - Class/ECON Lab,,
ECON112.1,ECON112.1 Introduction to Macroeconomics,Mon. 12:00-14:50,,B F2.17,,
ECON112.2,ECON112.2 Introduction to Macroeconomics,Mon. 12:00-14:50,,B F2.4,,
ECON202.1,ECON202.1 Intermediate Macroeconomics,Wed. 15:00-17:50,,B F2.5,,
ECON202.2,ECON202.2 Intermediate Macroeconomics,Wed. 15:00-17:50,,B F2.2,,
ECON204.1,ECON204.1 International Political Economy,Thu. 09:00-11:50,,B F2.5,,
ECON221.1,ECON221.1 Business Statistics II,Tue. 13:00-15:50,,B F2.2,,
ECON221.2,ECON221.2 Business Statistics II,Tue. 13:00-15:50,,B F2.6,,
ECON311.1,ECON311.1 Special Topics in Economics,Thu. 12:00-14:50,,B F1.1,,
ECON320.1,ECON320.1 Public Economics,Tue. 09:00-11:50,,B F1.1,,
ECON404.1,ECON404.1 International Monetary System,Wed. 15:00-17:50,,B F2.16,,
ECON430.1,ECON430.1 Growth and Development,Thu. 15:00-17:50,,B F1.17,,
EDU102.1,EDU102.1 Introduction to Pedagogy,Tue. 12:00-14:50,,B F2.16,,
EDU103.1,EDU103.1 Introduction to Foreign Language Pedagogy,Tue. 12:00-14:50,,B F2.16,,
EDU323.1,EDU323.1 Didactics,Mon. 15:00-17:50,,B F2.16,,
EE301.1,EE301.1 Analog Electronics II,Thu. 17:00-19:50,,A F2.13,,
EE305.1,EE305.1 Instrumentation and Measurements,Tue. 09:00-11:50,,B F2.14,,
EE321.1,EE321.1 Electrical Machines,Tue. 13:00-15:50,,A F1.4 Computer Lab,,
EE325.1,EE325.1 Embedded Systems,Wed. 09:00-11:50,,B F1.23 - Amphitheater I,,
EE422.1,EE422.1 Power Electronics,Tue. 09:00-11:50,,B F2.4,,
EE429.1,EE429.1 Digital Power Systems Protection,Mon. 15:00-17:50,,A F1.25,,
ELIT100.1,ELIT100.1 Academic English and Effective Communication,Tue. 12:00-14:50,,B F2.4,,
ELIT100.2,ELIT100.2 Academic English and Effective Communication,Mon. 09:00-11:50,,B F2.4,,
ELIT100.3,ELIT100.3 Academic English and Effective Communication,Mon. 09:00-11:50,,B F1.9,,
ELIT100.4,ELIT100.4 Academic English and Effective Communication,Wed. 09:00-11:50,,B F1.9,,
ELIT100.5,ELIT100.5 Academic English and Effective Communication,Thu. 09:00-11:50,,B F2.4,,
ELIT100.6,ELIT100.6 Academic English and Effective Communication,Mon. 09:00-11:50,,B F1.8,,
ELIT100.7,ELIT100.7 Academic English and Effective Communication,Thu. 09:00-11:50,,B F2.6,,
ELIT103.1,ELIT103.1 Non-verbal Communication,Wed. 09:00-10:50,,A B.1 - VACD Multimedia Studio,,
ELIT103.2,ELIT103.2 Non-verbal Communication,Wed. 12:00-13:50,,A B.1 - VACD Multimedia Studio,,
ELIT200.1,ELIT200.1 Critical Reading and Writing,Thu. 09:00-11:50,,B F1.8,,
ELIT200.10,ELIT200.10 Critical Reading and Writing,Mon. 12:00-14:50,,B F2.6,,
ELIT200.11,ELIT200.11 Critical Reading and Writing,Wed. 12:00-14:50,,B F2.8,,
ELIT200.12,ELIT200.12 Critical Reading and Writing,Tue. 12:00-14:50,,A F1.25,,
ELIT200.13,ELIT200.13 Critical Reading and Writing,Mon. 12:00-14:50,,B F2.5,,
ELIT200.14,ELIT200.14 Critical Reading and Writing,Thu. 12:00-14:50,,B F2.6,,
ELIT200.2,ELIT200.2 Critical Reading and Writing,Mon. 15:00-17:50,,B F2.6,,
ELIT200.3,ELIT200.3 Critical Reading and Writing,Fri. 14:00-16:50,,B F2.2,,
ELIT200.4,ELIT200.4 Critical Reading and Writing,Thu. 10:00-12:50,,B F1.9,,
ELIT200.5,ELIT200.5 Critical Reading and Writing,Fri. 14:00-16:50,,B F1.9,,
ELIT200.6,ELIT200.6 Critical Reading and Writing,Mon. 14:00-16:50,,A F1.23,,
ELIT200.7,ELIT200.7 Critical Reading and Writing,Mon. 09:00-11:50,,B F2.6,,
ELIT200.8,ELIT200.8 Critical Reading and Writing,Tue. 09:00-11:50,,B F1.8,,
ELIT200.9,ELIT200.9 Critical Reading and Writing,Thu. 12:00-14:50,,B F2.4,,
ELIT201.1,ELIT201.1 Academic Writing,Wed. 12:00-14:50,,B F2.1,,
ELIT203.1,ELIT203.1 Survey of English Literature II,Mon. 12:00-14:50,,B F1.16,,
ELIT208.1,ELIT208.1 Classical Mythology,Tue. 09:00-11:50,,A F2.3,,
ELIT401.1,ELIT401.1 The Romantic Age,Fri. 14:00-16:50,,B F1.17,,
ELIT406.1,ELIT406.1 Contemporary Drama,Thu. 12:00-14:50,,A F1.23,,
ELIT413.1,ELIT413.1 Literary Theory and Criticism II,Thu. 09:00-11:50,,B F1.16,,
ELIT415.1,ELIT415.1 Shakespeare,Tue. 12:00-14:50,,B F1.8,,
ELT105.1,ELT105.1 Introduction to Linguistics,Mon. 09:00-11:50,,B F2.16,,
ELT212.1,ELT212.1 English Syntax,Tue. 12:00-14:50,,B F1.9,,
ELT322.1,ELT322.1 English Language Teaching Methodology,Tue. 15:00-17:50,,A F1.17,,
ELT323.1,ELT323.1 Early Foreign Language Learning,Wed. 15:00-17:50,,A F2.3,,
ELT370.1,ELT370.1 Work Placement/Internship,Wed. 12:00-13:50,Thu. 09:00-09:50,A F1.26,B F1.9,
ELT371.1,ELT371.1 Teaching Practice I,Wed. 12:00-13:50,Thu. 09:00-09:50,A F1.26,B F1.9,
ELT471.1,ELT471.1 Teaching Practice II,Wed. 12:00-13:50,Thu. 09:00-09:50,A F1.26,B F1.9,
ELT571.1,ELT571.1 Teaching Practice III,Wed. 12:00-13:50,Thu. 09:00-09:50,A F1.26,B F1.9,
ENS201.1,ENS201.1 Electromagnetism I,Thu. 09:00-11:50,,B F2.8,,
ENS203.1,ENS203.1 Electrical Circuits I,Tue. 09:00-11:50,,B F2.15 - Amphitheater II,,
ENS204.1,ENS204.1 Thermodynamics II,Mon. 09:00-11:50,,A F1.17,,
ENS206.1,ENS206.1 System Modelling and Control,Mon. 15:00-17:50,,A F1.11,,
ENS207-6.1,ENS207-6.1 Engineering Graphics,Fri. 09:00-09:50,,B F1.25 Computer Lab,,
ENS209-3/6.1,ENS209-3/6.1 Statics,Tue. 17:00-19:50,,B F2.16,,
ENS211.1,ENS211.1 Signals and Systems,Tue. 17:00-19:50,,B F1.22,,
ENS309.1,ENS309.1 Ethics in Engineering and Natural Sciences,Mon. 12:00-14:50,,A F2.14 - Amphitheater II,,
IBF105.1,IBF105.1 Financial Literacy,Mon. 16:00-17:50,,B F1.9,,
IBF205.1,IBF205.1 Principles of International Business,Wed. 11:00-13:50,,B F2.5,,
IBF205.2,IBF205.2 Principles of International Business,Wed. 11:00-13:50,,B F1.8,,
IBF208.1,IBF208.1 Business Finance,Mon. 09:00-11:50,,B F2.1,,
IBF208.2,IBF208.2 Business Finance,Mon. 15:00-17:50,,B F2.8,,
IBF310.1,IBF310.1 Business Ethics,Wed. 09:00-11:50,,B F1.17,,
IBF401.1,IBF401.1 International Finance,Mon. 12:00-14:50,,B F2.1,,
IBF407.1,IBF407.1 Special Topics in Finance,Thu. 15:00-17:50,,B F1.1 FBA Graduate Seminar Room,,
IBF409.1,IBF409.1 Investment and Portfolio Management,Wed. 12:00-14:50,,B F1.22,,
IBF410.1,IBF410.1 Real Estate Markets,Wed. 15:00-17:50,,B F2.17,,
IE303.1,IE303.1 Operations Research I,Thu. 13:00-15:50,,B F1.23 - Amphitheater I,,
IE305.1,IE305.1 Work Analysis and Design,Thu. 13:00-14:50,,B F2.1,,
IE307.1,IE307.1 Quality and Reliability Engineering,Tue. 15:00-17:50,,B F1.9,,
IE425.1,IE425.1 Computer Aided Design and Manufacturing,Mon. 12:00-14:50,,A F1.18 - Computer Lab,,
IR100.1,IR100.1 Understanding the Contemporary World through Curre,Thu. 13:00-14:50,,B F2.15 - Amphitheater II,,
IR101.1,IR101.1 Introduction to International Relations,Wed. 14:00-16:50,,B F2.15 - Amphitheater II,,
IR212.1,IR212.1 Politics in Europe,Tue. 12:00-14:50,,B F1.22,,
IR213.1,IR213.1 International Issues in the Balkans,Mon. 15:00-17:50,,B F1.1,,
IR214.1,IR214.1 International Law,Wed. 12:00-14:50,,B F1.1,,
IR216.1,IR216.1 Foreign Policy Analysis,Mon. 12:00-14:50,,A F1.11,,
IR304.1,IR304.1 Security Studies,Mon. 12:00-14:50,,B F1.8,,
IR305.1,IR305.1 International Organisations,Thu. 13:00-15:50,,B F1.8,,
IR467.1,IR467.1 Energy Security,Thu. 09:00-11:50,,B F1.17,,
IR472.1,IR472.1 Human Rights,Tue. 12:00-14:50,,B F2.1,,
IR478.1,IR478.1 Islam in World Politics,Tue. 09:00-11:50,,A F1.11,,
ITA101.1,ITA101.1 Spoken Italian I,Wed. 09:00-11:50,,B F2.14,,
ITA102.1,ITA102.1 Spoken Italian II,Fri. 10:00-12:50,,A F2.13,,
LAW104.1,LAW104.1 Civil Law II,Tue. 09:00-11:50,,A F1.26,,
LAW106.1,LAW106.1 Roman Law,Fri. 09:00-11:50,,A F2.3,,
LAW118.1,LAW118.1 Constitutional Law II,Tue. 12:00-15:50,,A F2.3,,
LAW120.1,LAW120.1 Introduction to Law II,Thu. 09:00-11:50,,A F1.17,,
LAW202.1,LAW202.1 Administrative Law II,Wed. 17:00-19:50,,A F2.13,,
LAW204.1,LAW204.1 Contract Law II,Thu. 15:00-18:50,,A F1.10,,
LAW206.1,LAW206.1 Criminal Law II,Tue. 12:00-14:50,,A F1.23,,
LAW210.1,LAW210.1 Business Law,Tue. 17:00-20:50,,B F1.23 - Amphitheater I,,
LAW218.1,LAW218.1 Legal Writing and Drafting,Wed. 09:00-11:50,,B F2.17,,
LAW242.1,LAW242.1 Law and Literature,Thu. 12:00-14:50,,A F1.26,,
LAW302.1,LAW302.1 Property Law II,Fri. 09:00-11:50,,A F1.11,,
LAW310.1,LAW310.1 Intellectual Property Law,Mon. 09:00-12:50,,A F1.25,,
LAW316.1,LAW316.1 Insurance and Social Security Law,Wed. 12:00-15:50,,A F2.15,,
LAW333.1,LAW333.1 Tort Law,Thu. 09:00-11:50,,A F1.26,,
LAW402.1,LAW402.1 Commercial Law II,Tue. 15:00-17:50,,A F1.10,,
LAW406.1,LAW406.1 Execution and Bankruptcy Law,Fri. 14:00-17:50,,A F1.17,,
LAW408.1,LAW408.1 Criminal Procedure Law II,Tue. 09:00-11:50,,B F1.17,,
LAW416.1,LAW416.1 Inheritance Law,Mon. 15:00-18:50,,A F2.13,,
LAW443.1,LAW443.1 Legal Ethics,Tue. 12:00-14:50,,B F2.8,,
LAW533.1,LAW533.1 Comparative Administrative Law,Wed. 17:00-19:50,,A F2.13,,
MAC102.1,MAC102.1 Introduction to Media Studies,Tue. 15:00-17:50,,A F1.23,,
MAN102.1,MAN102.1 Introduction to Management,Fri. 09:00-11:50,,B F1.23 - Amphitheater I,,
MAN105.1,MAN105.1 Corporate Social Responsibility,Mon. 16:00-17:50,,B F1.8,,
MAN302.1,MAN302.1 Human Resource Management,Tue. 12:00-14:50,,B F2.17,,
MAN303.1,MAN303.1 Entrepreneurship and Small Business Management,Wed. 10:00-12:50,,B F2.4,,
MAN304.1,MAN304.1 Organizational Behavior,Thu. 09:00-11:50,,B F2.16,,
MAN328.1,MAN328.1 Sales Management,Thu. 09:00-11:50,,B F1.1 FBA Graduate Seminar Room,,
MAN332.1,MAN332.1 Business Law,Tue. 17:00-20:50,,B F1.23 - Amphitheater I,,
MAN352.1,MAN352.1 Consumer Behavior,Fri. 14:00-16:50,,B F2.17,,
MAN402.1,MAN402.1 Strategic Management,Tue. 09:00-11:50,,B F2.5,,
MAN406.1,MAN406.1 Innovation Management,Fri. 09:00-11:50,,B F1.1 FBA Graduate Seminar Room,,
MAN443.1,MAN443.1 International Marketing,Tue. 12:00-14:50,,B F1.1,,
MAN453.1,MAN453.1 Project Management,Wed. 12:00-14:50,,B F1.16,,
MATH100.1,MATH100.1 Mathematical Skills,Tue. 09:00-11:50,,B F1.23 - Amphitheater I,,Day and time change
MATH100.2,MATH100.2 Mathematical Skills,Mon. 09:00-11:50,,B F2.17,,
MATH101.1,MATH101.1 Calculus I,Wed. 17:00-19:50,,B F2.15 - Amphitheater II,,Day and time change
MATH101.2,MATH101.2 Calculus I,Wed. 16:00-16:50,Thu. 13:00-14:50,A F1.24 - Amphitheater I,A F1.24 - Amphitheater I,
MATH102.1,MATH102.1 Calculus II,Mon. 09:00-09:50,Tue. 12:00-13:50,A F1.24 - Amphitheater I,A F1.24 - Amphitheater I,
MATH201.1,MATH201.1 Linear Algebra,Mon. 14:00-14:50,Wed. 09:00-10:50,A F1.24 - Amphitheater I,A F1.24 - Amphitheater I,
MATH201.2,MATH201.2 Linear Algebra,Mon. 10:00-10:50,Wed. 12:00-13:50,A F1.24 - Amphitheater I,A F1.24 - Amphitheater I,
MATH201.3,MATH201.2 Linear Algebra,Thu. 09:00-11:50,,A F1.24 - Amphitheater I,,New Section
MATH205.1,MATH205.1 Numerical Analysis,Wed. 15:00-17:50,,B F1.23 - Amphitheater I,,
MATH207.1,MATH207.1 Vector Calculus,Mon. 12:00-14:50,,A F1.24 - Amphitheater I,,
MATH209.1,MATH209.1 Discrete Mathematics II,Thu. 09:00-11:50,,B F2.17,,
MATH209.2,MATH209.2 Discrete Mathematics II,Mon. 12:00-14:50,,A F2.3,,
MATH306.1,MATH306.1 Statistical Modeling,Wed. 13:00-15:50,,A F1.10,,
ME206.1,ME206.1 Engineering Materials,Wed. 10:00-12:50,,A F1.18 Computer Lab,,
ME211.1,ME211.1 Strength of Materials II,Mon. 12:00-14:50,,A F2.13,,
ME304.1,ME304.1 Fluid Mechanics I,Thu. 15:00-17:50,,A F1.11,,Day and time change
ME411.1,ME411.1 Renewable Energy Technology,Tue. 12:00-14:50,,B F2.14,,
ME410.1,ME410.1 Unmanned Aerial Vehicles,Thu. 09:00-11:50,,A F1.11,,Opened
NS103.1,NS103.1 Biology,Wed. 09:00-11:50,,B F2.16,,
NS112.1,NS112.1 Understanding Science and Technology,Thu. 09:00-10:50,,B F2.15 - Amphitheater II,,"ONLY for GBE, EEE, ME Students"
NS122.1,NS122.1 Physics II,Tue. 14:00-16:50,,A F1.11,,
NS207.1,NS207.1 Organic Chemistry,Tue. 09:00-11:50,,B F2.16,,
NS209.1,NS209.1 Genetics I,Tue. 09:00-11:50,,B F2.6,,
POLS101.1,POLS101.1 Introduction to Philosophy,Wed. 09:00-11:50,,A F1.26,,
POLS211.1,POLS211.1 Politics and the Media,Mon. 09:00-11:50,,B F2.5,,
POLS302.1,POLS302.1 Contemporary Political Thought,Tue. 15:00-17:50,,B F1.16,,
POLS304.1,POLS304.1 Politics in BiH,Wed. 12:00-14:50,,A F1.11,,
POLS499.1,POLS499.1 Graduation Project,Wed. 16:00-17:50,,B F1.16,,
PSY103.1,PSY103.1 Introduction to Psychology,Fri. 13:00-15:50,,A F1.10,,
PSY103.2,PSY103.2 Introduction to Psychology,Fri. 09:00-11:50,,B F1.17,,
PSY105.1,PSY105.1 Statistics in Psychology,Fri. 09:00-11:50,,B F2.15 - Amphitheater II,,
PSY105.2,PSY105.2 Statistics in Psychology,Fri. 09:00-11:50,,B F2.15 - Amphitheater II,,
PSY303.1,PSY303.1 Personality Psychology,Mon. 09:00-11:50,,A F1.11,,
PSY308.1,PSY308.1 Social Psychology,Mon. 15:00-17:50,,A F2.3,,
PSY310.1,PSY310.1 Introduction to Psychopharmacology,Thu. 09:00-11:50,,A F1.23,,
PSY311.1,PSY311.1 Organisational Psychology,Mon. 09:00-11:50,,A F2.13,,
PSY312.1,PSY312.1 Clinical Psychology,Tue. 13:00-15:50,,A F2.13,,
PSY329.1,PSY329.1 Psychometrics,Thu. 17:00-19:50,,A F1.25,,
PSY336.1,PSY336.1 Psychotherapy and Counseling,Mon. 12:00-14:50,,B F2.15 - Amphitheater II,,
PSY402.1,PSY402.1 Experimental Psychology,Wed. 09:00-11:50,,A F1.23,,
PSY406.1,PSY406.1 Positive Psychology,Wed. 15:00-17:50,,A F1.11,,
PSY412.1,PSY412.1 Abnormal Psychology,Tue. 10:00-12:50,,A F2.13,,
PSY414.1,PSY414.1 Psychology of Adulthood and Aging,Fri. 15:00-17:50,,B F2.6,,
PSY424.1,PSY424.1 Social Cognition,Thu. 12:00-14:50,,A F1.25,,
PSY457.1,PSY457.1 Emotion and Cognition,Thu. 15:00-17:50,,B F2.17,,
PSY458.1,PSY458.1 Neuropsychology,Tue. 15:00-17:50,,B F1.8,,
PSY490.1,PSY490.1 Graduation Project,Tue. 09:00-11:50,,A F1.23,,
PSY496.1,PSY496.1 Research Activity,Wed. 09:00-11:50,,B F2.2,,
SE211.1,SE211.1 Software Construction,Mon. 15:00-17:50,,A F1.24 Amphitheater I,,
SE308.1,SE308.1 Communication Systems and Networks,Wed. 09:00-11:50,,A F1.11,,
SE308.2,SE308.2 Communication Systems and Networks,Tue. 12:00-14:50,,A F1.10,,
SE407.1,SE407.1 Software Quality Management,Tue. 15:00-17:50,,A F2.14 - Amphitheater I,,
SOC102.1,SOC102.1 Introduction to Sociology,Thu. 15:00-17:50,,B F2.15 Amphitheater II,,
SOC311.1,SOC311.1 Sociology of Religion,Fri. 14:00-16:50,,B F1.1,,
SPS312.1,SPS312.1 Qualitative Research Methods,Wed. 15:00-17:50,,B F1.17,,
TLT114.1,TLT114.1 Turkish Language II (Turkish Morphology),Tue 09:00 – 11:50,,B F1.22,,
TLT212.1,TLT212.1 Introduction to Turkish Literature,Thu 09:00 – 11:50,,B F1.22,,
TLT214.1,TLT214.1 Turkish Language IV (Turkish Sentence Knowledge),Wed. 12:00-14:50,,A F1.25,,
TLT312.1,TLT312.1 Ottoman Turkish,Tue 12:00 – 14:50,,B F2.5,,
TLT317.1,TLT317.1 Teaching Language Skills (Understanding-Explanation),Thu 15:00 – 17:50,,A F1.23,,
TLT319.1,TLT319.1 History of Turkish Language,Wed 09:00 – 11:50,,A F1.25,,
TLT371.1,TLT371.1 Teaching Practice I,Mon 12:00 – 14:50,,B F2.2,,
TLT411.1,TLT411.1 Divan Literature,Tue 09:00 – 11:50,,B F2.2,,
TLT427.1,TLT427.1 Turkish Folklore,Thu 12:00 – 14:50,,B F2.2,,
TLT471.1,TLT471.1 Teaching Practice II,Mon 12:00 – 14:50,,B F2.2,,
TT304.1,TT304.1 Literary Translation,Thu 09:00 – 11:50,,A F2.13,,
TURK111.1,TURK111.1 Spoken Turkish I,Fri. 10:00-11:50,,A F1.10,,
TURK111.2,TURK111.2 Spoken Turkish I,Fri. 15:00-16:50,,B F2.16,,
TURK112.1,TURK112.1 Spoken Turkish II,Mon. 11:00-12:50,,A F1.26,,
TURK112.1,TURK112.10 Spoken Turkish II,Fri. 14:00-15:50,,,,NO in SiS no students registred
TURK112.2,TURK112.2 Spoken Turkish II,Tue. 10:00-11:50,,A F1.10,,
TURK112.3,TURK112.3 Spoken Turkish II,Tue. 14:00-15:50,,B F1.17,,
TURK112.4,TURK112.4 Spoken Turkish II,Wed. 11:00-12:50,,A F1.10,,
TURK112.5,TURK112.5 Spoken Turkish II,Mon. 11:00-12:50,,A F1.10,,ONLY TLT STUDENTS
TURK112.6,TURK112.6 Spoken Turkish II,Wed. 14:00-15:50,,A F1.23,,
TURK112.7,TURK112.7 Spoken Turkish II,Mon. 15:00-16:50,,B F2.4,,
TURK112.8,TURK112.8 Spoken Turkish II,Thu. 13:00-14:50,,A F1.11,,
TURK112.9,TURK112.9 Spoken Turkish II,Fri. 10:00-11:50,,B F2.16,,
VA104.1,VA104.1 Language of Drawing II,Wed. 12:00-14:50,,A B.16 - VACD Drawing Studio,,
VA104.2,VA104.2 Language of Drawing II,Tue. 13:00-15:50,,A B.16 - VACD Drawing Studio,,
VA211.1,VA211.1 Digital Vector Graphics,Wed. 09:00-11:50,,B F1.24 (MAC Studio),,
VA211.2,VA211.2 Digital Vector Graphics,Fri. 09:00-11:50,,B F1.24 (MAC Studio),,
VA217.1,VA217.1 Graphic Design II,Tue. 15:00-17:50,,B F1.10 Class/ART Studio,,
VA217.2,VA217.2 Graphic Design II,Mon. 14:00-16:50,,B F1.10 Class/ART Studio,,
VA217.3,VA217.3 Graphic Design II,Wed. 15:00-17:50,,B F1.10 Class/ART Studio,,
VA304.1,VA304.1 Typography II,Thu. 15:00-17:50,,B F1.24 (MAC Studio),,
VA306.1,VA306.1 Digital Photo Imaging,Tue. 15:00-17:50,,B F1.25 Computer Lab,,
VA306.2,VA306.2 Digital Photo Imaging,Mon. 09:00-11:50,,B F1.25 Computer Lab,,
VA310.1,VA310.1 Advanced Drawing I,Tue. 09:00-11:50,,A B.16 - VACD Drawing Studio,,
VA312.1,VA312.1 Photography,Thu. 09:00-11:50,,A B.1 - VACD Multimedia Studio,,
VA312.2,VA312.2 Photography,Fri. 09:00-11:50,,A B.1 - VACD Multimedia Studio,,
VA314.1,VA314.1 Non-Linear Editing II,Thu. 12:00-14:50,,A F1.18 - Computer Lab,,
VA315.1,VA315.1 Compositing and Digital Effects II,Tue. 12:00-14:50,,B F1.24 (MAC Studio),,
VA323.1,VA323.1 Illustration Studio,Mon. 15:00-17:50,,B F1.24 (MAC Studio),,
VA323.1,VA323.1 Illustration Studio,Fri. 12:00-14:50,,B F1.24 (MAC Studio),,New section
VA324.1,VA324.1 History of Graphic Design,Fri. 15:00-17:50,,A F2.14 - Amphitheater II,,
VA334.1,VA334.1 Packaging Design,Fri. 09:00-11:50,,B F1.10 Class/ART Studio,,
VA341.1,VA341.1 Digital Desktop Publishing I,Wed. 09:00-11:50,,B F1.25 Computer Lab,,
VA406.1,VA406.1 User Experience Design (UX Design) I,Wed. 15:00-17:50,,B F1.24 (MAC Studio),,
VA416.1,VA416.1 Design Studio II,Mon. 09:00-11:50,,B F1.24 (MAC Studio),,
VA443.1,VA443.1 Information Graphic Design,Tue. 09:00-11:50,,B F1.24 (MAC Studio),,
VA451.1,VA451.1 Documentary Film Production,Mon. 12:00-14:50,,A B.1 - VACD Multimedia Studio,,
VA452.1,VA452.1 Show Reel Production,Thu. 09:00-11:50,,B F1.24 (MAC Studio),,
VA455.1,VA455.1 3D Design II,Wed. 12:00-14:50,,B F1.24 (MAC Studio),,
